,comment_id,comment_parent_id,comment_body,comment_link_id,comment_author
323,eayal9l,eay7p8s,"It's just acknowledging that no one is perfect, and most people are eager to assume they're the one in the wrong.",t3_9xbawu,TickleMeStalin
324,ea3omjt,e9riqad,**UNEXPECTED ITEM IN BAGGING AREA**,t3_9xbawu,Morrtyy
325,e9si3tx,e9septv,I work at a steel mill and do the same thing when things are slow on day shift. Nobody is going to question or follow the guy carrying a shovel,t3_9xbawu,joec0ld
326,e9smebl,e9sg8hh,Bureaucramancy. ,t3_9xbawu,selectiveyellow
327,e9s38n4,e9rofo9,[deleted],t3_9xbawu,
328,e9s2dbp,e9s0a6j,"This sounds like the coin on a string trick, but with two bills taped together so it fools the scanner. The feeder would vomit both bills back at you after the scanner detected a good $5 bill and an unreadable bill.",t3_9xbawu,LevelSevenLaserLotus
329,e9rxokk,e9ru2ew,"Are you sure it's a felony? Stealing $5 in quarters is petty theft pretty much everywhere. Taping bills together isn't counterfeiting - you're not passing the $1 off as a $5.

Of course if you get convicted of petty theft over $5, you deserve all the razzing you get.",t3_9xbawu,Hinermad
330,e9s35v5,e9rjutt,More like r/IllegalLifeProTips,t3_9xbawu,KIMoFy
331,e9sasxt,e9s5zfn,Reminds me of the time 4chan figured out how to make manufacturer's coupons for whatever you want and they would work. Bunch of people redeeming [free Playstations](https://i.imgur.com/ww1vslI.jpg) and very quickly those coupons were all banned.,t3_9xbawu,Chancoop
332,e9s0r3g,e9ryc92,"He really is. He's a sensitive guy that never really learned how to express dissatisfaction well. When we talk, he's actually quite reasonable. It's almost like he puts on a persona for everyone else, and hates that persona. ",t3_9xbawu,boundbythecurve
333,e9rc3pb,e9rah4i,[deleted],t3_9xbawu,
334,e9s9mqs,e9rvagf,"Wanted to say this. We had a girl that we absolutely adored, so we asked for a manager to compliment her and she immediately sat down with us and asked if everything was ok. Lol! Her concern was precious. ",t3_9xbawu,556pez
335,e9scyfx,e9rvagf,"Yeah I've heard stories about people going to Guest Relations and the clerk there basically being dead-eyed until the guest is like ""hey so-and-so really helped us out today and I want to say thanks!"" and the clerk gets this totally baffled look on their face",t3_9xbawu,OneGoodRib
336,e9sf186,e9rvagf,[deleted],t3_9xbawu,
337,e9sfj4g,e9rvagf,"My husband worked for the local council doing parking tickets (the entry position to get to the department he actually wanted to work), I had seen him come home so stressed and upset as EVERYONE abused him all day. One day; I had some contractors parked across my driveway and I needed to leave the house. They ignored me, so I called council a coworker of my husband came and moved them along for me after my attempts failed. I called up and raves about how amazing they were and how happy I was with their professionalism, knowledge, and how they dealt with the issue in a swift manner. The woman at the call centre was shocked to hear a compliment.  Later when I finally met the coworker they had gotten an award and it helped them move onto another area where they had wanted to get into having the award on their file. So I now make sure to pass on compliments often. ",t3_9xbawu,PixieLarue
338,e9siaha,e9s5w8s,"I let one rip once and my uncle said ""Not bad for a 1 inch speaker"" 

Could not stop laughing",t3_9xbawu,WiseGuyCS
339,e9s86qq,e9s78v5,I’m a professor and this is my nightmare.,t3_9xbawu,myotherbannisabenn
340,e9syg1o,e9s7fsk,It’s like a kid asking you to answer a toy phone ,t3_9xbawu,
341,e9sqi8c,e9s7fsk,Beautiful.,t3_9xbawu,b2a1c3d4
342,e9sdb72,e9rtpwy,"I have found this tip out because of how often I love retelling my immigrant dads variation of this song: sang at me for no reason and with gestures when I was 16:


""I'm a little teapot!

Short and stout!

Here is the handle, here is the spout.  

When I get to steam-hot **I pour my contents out.**

Tip me over and pour all out!""

 ",t3_9xbawu,mimimart
343,e9s6bux,e9rtpwy,Just tried this at my office...totally works,t3_9xbawu,petermakesart
344,e9rvpik,e9rulm6,"I’m a little teapot, short and stout. Here is my handle, here is my spout. When I get all steamed up, hear me SHOUT! Tip me over and pour me out!",t3_9xbawu,InsertPlayerTwo
345,e9rlp1t,e9riz75,Bring it around town.,t3_9xbawu,Excal2
346,e9rqe3m,e9riz75,"I second this. We gotta know if the chicken:

* has to be waved in a circle like you're drawing a O in the air
* held still while you spin in a circle
* rotate the chicken vertically
* rotate it horizontally

so many possibilities!",t3_9xbawu,Jek2424
347,e9rs1lf,e9rp7xb,Wth are they digging those grave looking holes? ,t3_9xbawu,termoventilador
348,e9rpgmq,e9rp7xb,"That was cool, thanks for sharing.",t3_9xbawu,redblackjoker
349,e9rt26a,e9rp7xb,Anyone know why he would need them to do that?,t3_9xbawu,youshantpass
350,e9rt4cv,e9rozng,Oklahoma birthday parties.,t3_9xbawu,HoboTheDinosaur
351,e9rnb0b,e9rect1,"You meant to tell me ""youcancurecancerwithessentialoils.com"" isn't giving completely legitimate health advice? Nonsense! ",t3_9xbawu,sohcgt96
352,e9s83cl,e9s06lw,"Just go to scholar.google.com and type in keywords on the topic. The caveat is that you need to employ a bit  of scholastic vocabulary and avoid common diction.  
Next, find where it says ""DOI"" or ""DOI.org"" and copy the string that follows. It should look roughly like  

    10.1016/S0140-6736(07)60464-4  
  
Next, go to sci-hub.se and paste the DOI in the big input field in the middle of the site. You now have the full publication. If you're in a hurry to get through many studies in order to get an overall grasp on a topic, just skip to the conclusion.  
  
Also important to note is that meta-analysis is normally the golden standard for accurate and reliable insight. A good grasp on statistics is the most enlightening. If you didn't take a statistics course in college, it is never too late to enroll in a community college course or a MOOC.
  

",t3_9xbawu,ManWithTunes
353,e9r5tmx,e9r4cp2,He leaves his car at work so people think he never leaves lol. Makes a secret nook under his desk for work naps. George is an inspiration. ,t3_9xbawu,AdventuresOfKrisTin
354,e9rg1wf,e9r4cp2,"I have been using this technique for years, and it works quite well.  About 5 years ago I upped my game by carrying a clipboard around as well.  If you walk around with a clipboard, muttering under your breath and shaking your head in disapproval, everybody will leave you the fuck alone.  ",t3_9xbawu,irritablemagpie
355,e9r7pjl,e9r28kk,"> Also, equip a lab coat and clipboard and act like you belong.

A group of mates and I stole a table from our college doing that once. There was a sign-in desk at the front of the student center where you had to scan your ID to enter. I walked in with 4 guys in matching shirts behind me, and I was carrying a clipboard. We walked straight past the person at the desk, I pointed out a table and jotted some scribbled down, they packed up one of the tables, and walked out, never got questioned.

It's amazing how much you can do if you carry yourself like you're supposed to be there.

Edit: Yes guys I know about /r/ActLikeYouBelong, ~~5~~ lost count at 50 separate people have already commented it, and multiple people have PM'd me it. You really don't have to keep doing it.

Edit2: Neat, most upvoted comment is about me stealing a table.",t3_9xbawu,Vet_Leeber
356,e9r3m0t,e9r28kk,[deleted],t3_9xbawu,
357,e9ravr3,e9ragn3,Eat the pizza ,t3_9xbawu,Narcissistic_nobody
358,e9rcp6x,e9ragn3,"I went to see Busy P live at a festival, when it was his turn to perform he walked through the audience before going on stage. I reached out to try and get a selfie, but his security saw this as a huge no-no and launched over to 'protect' him on his way to the stage. This included the guard that was guarding the backstage entrance... they left the gate wide open! I glanced at my friend and we both smiled and nodded at the same time as we sneaked our way into the backstage. 

For some reason everyone backstage was extremely friendly, which i did not expect. Some guy saw us and noticed we weren't holding a drink and immediately served us two Grey Goose screwdrivers. Lots of food and booze, lots of friendly people, great view of the stage... ",t3_9xbawu,dnb1111
359,e9rdg3l,e9ragn3,[deleted],t3_9xbawu,
360,e9rbgj9,e9ragn3,Cocaine,t3_9xbawu,joey_fatass
361,e9rbre0,e9r9thb,So deliver pizzas in a hard hat and a tie. Got it!,t3_9xbawu,Dog1234cat
362,e9r9cs7,e9r7o61,"Did you try carrying a clipboard too, just in case?",t3_9xbawu,Skhmt
363,e9rbex3,e9r7o61,[deleted],t3_9xbawu,
364,e9rbpbc,e9r7o61,We received training at our company that says the vast majority of company theft and espionage aren't sophisticated hackers but simple things like leaving your password written on a sticky note next to your computer and most importantly: holding the door open for people at security check points where a badge or code is needed to advance.,t3_9xbawu,OneBeerDrunk
365,e9raong,e9rab51,Plus you have 2 beers,t3_9xbawu,bwfixit
366,e9rc176,e9rab51,"Can only speak to this as it relates to hockey games, but, know in advance where you're going to sit.

If an usher sees you eye balling seats and looking around, you're sunk a lot of the times.

Also scope out unsold spots on stubhub or other ticketing sites to know what's open. ",t3_9xbawu,Destillat
367,e9rxrt0,e9rs1dk,"my version is similar:  ""thank you, that's a very nice thing to say!""

:)",t3_9xbawu,OctagonalButthole
368,e9rxhti,e9rwgk4,"I’m going to use that response for all compliments.

“Nice shirt! Is it new?”

“Thank you, it has pockets!”

“I didn’t know you had a pet kangaroo! This is great!”

“Thank you, it has pockets!”

“Dinner was great! I haven’t had calzones in ages.”

“Thank you, it has pockets!”",t3_9xbawu,ask_me_about_cats
369,e9rctmp,e9r544n,She's dealing with 3-4 year-olds. Soiled pants are inevitable.,t3_9xbawu,
370,e9rgk0b,e9r544n,"""I said sitting muscles, not shitting muscles!""",t3_9xbawu,Xavis00
371,e9raz04,e9r4mmb,It's all fun and games until someone puts on their wizard hat...,t3_9xbawu,warneroo
372,e9r78sg,e9r395c,"Going to use this on my colleagues. 
 
""Can you use your 'shutthefuckup' muscles and shut the fuck up!""",t3_9xbawu,poopellar
373,e9r5dyi,e9r3mip,You're going to be sorry when the kid starts using peds to increase his listening muscles. Kids going to listen so hard you won't want to make a peep.,t3_9xbawu,Ownza
374,e9rqhts,e9ribp1,"If you weren't told you were smart as a kid, would you still be a terrible worker? That is the real question. ",t3_9xbawu,NeverCast
375,e9rx8cg,e9rmqeg,[deleted],t3_9xbawu,
376,e9rtxbj,e9rmqeg,"It's a tone/inflection thing. You just haven't found the right one yet. Kids sense weakness/uncertainty. Gf has a niece and nephew that are horribly behaved and dont listen for shit to anyone typically. When I tell them to stop, they sit down and shut the fuck up.",t3_9xbawu,Somebodys
377,e9r9wjt,e9r8v5z,Damn that's surprisingly deep. I mentally went through all of my hobbies just now and realized I picked up most of them because someone close to me influenced me into trying them out,t3_9xbawu,MehNameless
378,e9r7ki8,e9r44vw,You can control the heartless though. ,t3_9xbawu,iamdavid2
379,e9raj1c,e9r8lst,This definitely happened multiple times throughout my short life. It took a while to really understand who you should invest time and energy into. ,t3_9xbawu,bk_cheech
380,e9rsi42,e9rjiu6,"""Sorry, I'm not gonna be able to make it to your party because of my crippling social anxiety.""",t3_9xbawu,FroMan753
381,e9qzcld,e9qyqv6,"> If we want to make smart choices and have accurate beliefs we have to challenge ourselves and at least try to weed out all the wrong beliefs before they become dumb choices.

Why do you think that?
",t3_9xbawu,HacksawJimDGN
382,e9r01gm,e9qzeta,Works every time.,t3_9xbawu,Taiwanderful
383,e9r9h5s,e9qzeta,Fucking Han Solo’s biggest missed opportunity ,t3_9xbawu,WunWegWunDarWun_
384,e9r9lof,e9qzeta,"""Shut up baby! I know it!",t3_9xbawu,h4rlotsghost
385,e9qw1ik,e9qvr5h,Shucks thanks,t3_9xbawu,Taiwanderful
386,e9rb1ao,e9r9dd5,"Yeah, coded implications like that are virtually always intended to provoke a reaction in the listener without outright attacking. That way, they look rational and you look emotional (the greatest of sins, of course). 

Like, when my uncle Tim says ""boy, sure are a lotta queers in this town these days!"" it's best to just go ""okay..."" He *means* ""...and that's a bad thing,"" but if I respond before he actually says so, I look ""oversensitive"" or like I'm ""just looking to be offended.""",t3_9xbawu,ReeseSlitherspoon
387,e9r5gzy,e9r47ww,Try 200percentoff and see if they'll actually pay you to take their product.,t3_9xbawu,de_G_van_Gelderland
388,e9r98kz,e9r67ul,"This worked for me with Walmart a few weeks ago. They didn't actively tell me the item was priced lower due to being left in my cart, but when I left it overnight and went back the next day, I noticed it was suddenly lower while in my cart but the same price on the actual site",t3_9xbawu,jereMyOhMy
389,e9r71t9,e9r67ul,"This works with some meal kit delivery for the first order, too",t3_9xbawu,Arya_kidding_me
390,e9r9ivb,e9r5zo8,This is diametrically opposite from my experience as an inquisitive child.,t3_9xbawu,londoncatvet
391,e9rdtm9,e9r99qz,"""Hey, take off your pants and let me warm those babies up!""",t3_9xbawu,wagyu_doing
392,e9ril6e,e9r99qz,"If you suffer from sweaty feet, take off your socks and put them on a  heater. It'll dry them off in minutes, make them warm and toasty and give your office a hearty burnt cheese scent.",t3_9xbawu,Bodymaster
393,e9rl5in,e9r319c,"I just have a Costco membership and gas is seriously around 60 cents cheaper there than anywhere else in the area. That membership seriously pays for itself in gas alone, buying anything inside the store is bonus.",t3_9xbawu,hokie_high
394,e9rn24u,e9ra4gr,I majored in Sociology so most of my assignments were papers... I got through college with WorldCat and wasn't aware of the online code thing until my Math/Science friends complained.,t3_9xbawu,consuellabanana
395,e9rbl5m,e9r8qbo,My teeth are fucked up and it’s seriously my biggest insecurity. People notice immediately. How old were you when you got them fixed?,t3_9xbawu,73173
396,e9r8vv4,e9r7zn8,Gotta be a tad more funny than avg if you're a fat guy to overcome the handicap. ,t3_9xbawu,celluloidandroid
397,e9rgxdq,e9r9uyh,"That last point is my problem.  

I'm never comfortable when I'm dressed up. If I put on anything fancier than a t-shirt and jeans I feel like a poser.",t3_9xbawu,DiscoshirtAndTiara
398,e9ro5qg,e9rg2d6,[deleted],t3_9xbawu,
399,e9ri1jn,e9rg2d6,"I misread ""I hit her constantly""... Thank god I can't read.",t3_9xbawu,h0k5
400,e9rjb7b,e9rfpq4,"Well that’s a lot less crude than my motto:

I keep my husband’s balls empty and his stomach full. ",t3_9xbawu,dani_bar
401,e9rbiiy,e9qxq49,"When you really truly listen, it's something special. You can even take it too far if you try hard enough. 

Everyone wants to be listened to, and they will absolutely open up regardless of who you are if you genuinely listen with your entire being.

I've had a guy go from telling me his name to telling me his entire family's financial situation, his deep internal struggles, and basically every emotion he's gone through over the years, all over a 30 minute conversation. By the end I could actually see the genuine happiness in his face from having opened up so thoroughly.

Another time I talked to a girl I was kinda friends with, and after an hour of talking and slowly opening up, she actually told me about the sexual abuse she suffered as a child(which she hadn't talked about to literally anyone before) and how utterly afraid she was of it ever coming to light. Honestly I just went into complete shock hearing that, especially considering we only recently became friends. A crazy level of opening up.

Seriously, listening is a really strong ability that we take for granted far too much.",t3_9xbawu,RevolsinX
402,e9r9oa2,e9qwt9l,"Some people at work think I'm their closest friend, and I've said a handful of words to them. But they just keep talking at me, and it feels like a conversation to them. ",t3_9xbawu,ncolaros
403,e9r978q,e9qypgp,"I always put my lunch in same spot of the refrigerator, every day. Janice knows this. And what do I see on Monday at lunch time? My lunch box in the middle of the top shelf. That's what. And I know it was Janice because I asked Denise and she told me that bitch moved it. I swear to god, Janice thinks she can do whatever she wants just because she's in a wheelchair. We'll see how she likes it when I ""accidentally"" drop a pair of scissors on her colostomy bag in front of everyone at the productivity meeting.",t3_9xbawu,Brawndo91
404,e9r96oq,e9r6dwv,"That's stupid though.  Just because you know how to do something well, doesnt make it less difficult and/or time consuming.",t3_9xbawu,MrFlibble81
405,e9r7xoz,e9r6gwx,My man.,t3_9xbawu,RUALUM15
406,e9ra0t4,e9r6gwx,Look at this guy with a girlfriend,t3_9xbawu,james_hsiaooo
407,e9rb2xe,e9r5ruw,"""work smarter not harder""",t3_9xbawu,RandomNumsandLetters
408,e9r9tql,e9r7ddo," Scotty: Do you mind a little advice? Starfleet captains are like children. They want everything right now and they want it their way. But the secret is to give them only what they need, not what they want.

Lt. Commander Geordi La Forge: Yeah, well, I told the Captain I'd have this analysis done in an hour.

Scotty: How long will it really take?

Lt. Commander Geordi La Forge: An hour!

Scotty: Oh, you didn't tell him how long it would *really* take, did ya?

Lt. Commander Geordi La Forge: Well, of course I did.

Scotty: Oh, laddie. You've got a lot to learn if you want people to think of you as a miracle worker. ",t3_9xbawu,PyroDesu
409,e9raycr,e9r806q,"Same. I joke around with my boss a lot and I know he gets a little tired of it sometimes, but he always lets it slide because I'm a reliable worker and have never called out from work except for one time when my dog was sick. ",t3_9xbawu,SirWildman
410,e9rbrc2,e9rb6pa,"That’s true and that sucks, I’m mostly talking about networking and not about deep friendships that I care about",t3_9xbawu,Nrich5
411,e9raz4q,e9r936a,"ask open ended questions that you cant answer with a simple no or yes. Then, once the ball is rolling, organically lead the convo with more questions and try to tie in with stuff they said before. Mirror body posture.",t3_9xbawu,asgphotography
412,e9revfe,e9r936a,"When someone is talking to you, take what they're saying and construct it in your head. Those blank spots that you haven't filled in? Thems your questions.

This will also naturally gravitate the conversation towards things you are interested in because you tend to ignore the blank spots you don't care about. ",t3_9xbawu,Zesty_Pickles
413,e9rgo6j,e9r936a,"Ralph Waldo Emerson, one of the Transcendentalists and a great American philosopher and poet, is quoted as saying ""In my walks, every man I meet is my superior in some way, and in that I learn from him.""

If one of the greatest American poets of all time can learn from anyone he meets, so can you.  Find out how that someone is superior in some way - they must have had a life experience that you never had - and learn it.
",t3_9xbawu,MikeyNg
414,e9riiac,e9r92gw,"This true. Which is why the admit when wrong cheat needs to be used at the right time and in the right way. You have to be clear about what you’re wrong about why also being complete enough to get to the root of a problem. But you’re right you need to be careful about it. 

Like you’re playing Mario 3 you don’t want to use the P-wing in a water level its useless there. You need to use it on the right level at the right time to maximize the cheat benefit. ",t3_9xbawu,VulfSki
415,e9r4gfv,e9qxtc3,"As someone who has worked in retail and the service industry in the past, I can confirm. Nothing makes you see red faster than a customer immediately using that tone of voice that implies you're some kind of *idiot* for their being dissatisfied. *Especially* if their issue turns out to be the result of their own stupidity or dickheadedness.",t3_9xbawu,Dahhhkness
416,e9r2pzu,e9qzpvu,"If you're gonna be an asshole, you better have a *damn* good reason for it.",t3_9xbawu,Dahhhkness
417,e9r2mwy,e9qzdbf,"Not just jobs, but being punctual for anything--appointments, dates, meet-ups, events. I honestly get *stressed* if I'm not at least 15 minutes early to anything I need to go to, especially if I'm traveling with someone who chronically won't start getting ready until the last-minute, *Louise.*",t3_9xbawu,Dahhhkness
418,e9r8y7q,e9qzdbf,"Just a caution on this... this is culture dependent.  I’m working in Korea right now, at a center for children with learning disabilities.  I have a personal “thing” about getting home at a reasonable hour, and my schedule has me teaching until 6... I have to take the bus home, so if I leave right at 6 I get home at 7, which isn’t super late, I know, but I do feel like my evenings are _my_ time, so I want to preserve them as much as I can.  

So, what I do is go in early.  Really early.  I’m usually the first one there, I do all my prep for all my classes, I clean my personal classroom (we do one on one lessons or small groups, and we all have our own personal rooms), I make activities... but no one (but the cleaning lady) notices or cares.  But they _all_ notice when I leave... and I do leave before most of the others most days.  It’s always a “oh, you are going?  _Now_?” And I smile and nod, say “I have no more students”, and get a slow, but skeptical nod.  It sucks.  I know culturally I _should_ stay late, but like...fuck that.  Coming in later would mean I have more _me_ time in the morning, but that isn’t relaxing because I know I have to go to work.  Evenings are mine.  I do all my work before anyone else shows up so... argh... ",t3_9xbawu,lonelady75
419,e9r5q1p,e9r0krr,"Whenever I'm about to do something, I think, ""Would an idiot do that?"" And if they would, I do not do that thing.",t3_9xbawu,George_Kostanza
420,e9rbijc,e9r7p3y,"I think the Beauty Bonus is helpful if your identity is rooted in something other than your appearance. Then your core sense of self isn't determined by your face/body, if that makes sense.  I've noticed late bloomers tend to be more grounded/have stronger personalities because they didn't always rely on their looks.

&#x200B;

edit: you're to your",t3_9xbawu,addjazztomine
421,e9r62lj,e9r2nh3,"I always thought this was bullshit till recently. 
About 8 months ago I started going to the gym religiously every other day and did my hair every morning instead of just hoping out of the shower and drive to work, and while it hasnt been a huge change, you notice people act different towards you even if just subtly.

People are more willing to help you withouth asking, you get more smiles from strangers on the street.

Definitely will keep it up and improve myself further.",t3_9xbawu,elninofamoso
422,e9r5j1c,e9r2nh3,"Guys, unless you're trying to cosplay as a teenager at the prom in 2004, get your suits *fitted.*",t3_9xbawu,Dahhhkness
423,e9r72fx,e9r5lay,"Thank you for this. I’ve had insomnia for as long as I can remember and I always just lay in bed for hours waiting for sleep. I gotta get up and do something mundane! 

Also, I don’t know if this is true for others but I have what I call, “sleep windows.” It’s the time of night where my eyelids actually feel heavy and I feel like I could sleep. If I don’t go to bed at the beginning of a sleep window, I can’t fall asleep until the next one. ",t3_9xbawu,
424,e9r5r3u,e9r4ycc,"I don't know why that made me laugh so hard, but it did. ",t3_9xbawu,Schmicky
425,e9r8unx,e9r4ycc,Yes?,t3_9xbawu,Duck__Quack
426,e9ruf67,e9rshjx,"I usually get 2 tortillas at the end and my friend and I would split the bowl and create two burritos from it in the restaurant. We've gotten an equal combination of weird looks and the look of ""oh fuck why didn't I think of that""

Edit: if there are any Chipotle corporate workers out there reading this, please don't ruin this by enacting some stupid no tortilla policy to get people like me to buy the more expensive burritos. It's the only thing good in my life. ",t3_9xbawu,vicabart
427,e9rftrp,e9r9ufh,[deleted],t3_9xbawu,
428,e9rfmbj,e9rd35p,She said that to me too,t3_9xbawu,mars-is-green
429,e9r92mg,e9r6pm4,"Or, alternatively: ""he who strikes first strikes best.""",t3_9xbawu,BlindMidget
430,e9rlqqj,e9r6465,Repeat after me:. I don't speak to police without a lawyer present.,t3_9xbawu,Nereval2
431,e9rfhmx,e9rcf66,Says the Aussie,t3_9xbawu,
432,e9r9ukw,e9r7ymk,thank you for your loss,t3_9xbawu,The_Pundertaker
433,e9rc9j4,e9r7ymk,Thank you for having this funeral with an open bar ,t3_9xbawu,thewad14
434,e9qxnde,e9qx3ky,Motherlode.,t3_9xbawu,
435,e9rc3vp,e9r7rwk,[deleted],t3_9xbawu,
436,e9rbxb5,e9qygyv,"And take a lot of naps during the week! 

Because when you sleep, there’s no lonely time, *just dreams*",t3_9xbawu,mikaelb657
437,e9r6gd8,e9r4t0x,"> Wait until you tell them you eat soup with a knife

ah, I see you *haven't* played knifey-spooney before",t3_9xbawu,
438,e9r7ojy,e9r60tr,"Oh dont worry, the trending notifications will be there",t3_9xbawu,iCan20
439,e9qwe9h,e9qw6ag,Stop winking when you lie,t3_9xbawu,improvisedHAT
