,comment_id,comment_parent_id,comment_body,comment_link_id,comment_author
146,e9saa7v,9xbawu,"The harder you squeeze the weights or bars or whatever you are gripping when you work out, with every finger, even the pinky, and all the other fibers in the hand just squeezing as hard as they can all the way around, the stronger and more durable your hands and forearms will be even if you only do low weight stuff.

The purpose of muscle building is to flex against the resistance. When you push a barbell for bench pressing, don't just push with your arms. Flex your entire body, drive your feet through the floor as you try to crush the earth with your toes and heel. Flex your chest and back, your obliques, abs, shoulders, deltoids, etc. Flex everything you can to turn your body in to a solid unit of force that is pressing against the bench, the floor, and the barbell, while the rest of your entire body is flexing for support.

Squeeze that barbell like you want to strangle the person who burned your family alive, squeeze your biceps and triceps, and push it off of you like you're pushing it in to the face of the person who did that.

If you're a noob, slow down and gradually get used to flexing harder and harder. You don't wanna pop or tear something if you aren't used to what good and dangerous levels of flexing feels like.

But, the one thing you should always try not to flex, are your neck and head muscles.

Feel your jaw, your vocal cords, everything should be relaxed as much as you can help it. That's what people mess up on, they flex with their faces and neck as they exert themselves when they shouldn't be doing that at all.

Take deep powerful continuous breaths as you flex your entire core and diaphragm. Focus on flexing your entire torso and breathing slow and deeply, focus on doing that instead of flexing your neck and face.



Same with pull ups. Start by first locking every finger around the bar and try to crush it in to powder, then flex the entire rest of your body as you do pull ups and leg raises and stuff.

When you finish, you will feel swole as hell, everything will feel pumped with blood, loosened up,  and every fiber in your body will be plenty stimulated.

You will make gains like 10x faster. So many people try to only barely use enough muscle to do the exercise. First of all, you can pull or break something without tightening up your entire torso and back and legs and shoulders and fingers when you're lifting anything heavy. Flexing = more stability, more stimulation, more power, more adrenaline, more everything, way better protection against pulling something or breaking something.

Not flexing properly while lifting = you're begging your muscles to rip and your bones to pop out like air hockey pucks.

Just watch videos of gymnasts doing their olympic ring routines and stuff, and olympic heavy lifters. Minus their facial muscles straining, you should flex like they do when doing exercises.

It also helps with running. It gives you more power and support to be conscious of your feet and ankles and keep them flexed so that they can handle the impact more and practice using those muscles to blast you off the ground with each step.

Michael Jordon was so quick not because of genetics, but because he was more actively using those muscles to bounce him off the floor with each step.

Try hanging for as long as you can, and when it gets a little fatigue-pained or you feel like its starting to slip, try to squeeze your hands and biceps and deltoids and all of that even harder and harder, mostly focusing on your hands and forearms.

You will last longer, more muscle fibers will get evenly stimulated and will support each other, and your wrists and fingers will feel way more loose and powerful, and you will tremendously increase your strength and endurance.

TL;DR flex properly when working out, flex and squeeze very hard, even on light weights, and you will get better gains and endurance and less chance of injury, and feel more loose.

**Protip for any homebound, broke people.** : Get the doorframe pullup bar for like 15 bucks and put it on your closet or bedroom doorframe. All you have to do, is focus on your hands at first. Start with just hanging, and squeezing the bar with all your fingers, and just get used to hanging on and gripping as hard and tight as you can.

Go ahead and swing a tiny bit, using your abs and back to gently pull your body up in front of you or up behind you. After a while, you can gradually try to pull yourself up.

Always put your main focus on your fingers and palm and thumb, and all the other fibers in your hands. 

Your hands and forearms are your #1 tools, and are the foundation upon which you build the rest of your body.

Nothing is more important than your ability to master the art of squeezing things with all of your fingers together, and flexing everything in your hands.

Your biceps and forearms and shoulders and triceps and stuff only contract to their fullest when the hands are fully engaged. Everything is connected, even between the lower and upper arms. 

Working out your hands sympathetically works out the rest of the arm muscles, and gives them a foundation upon which they can contract. 

Eventually work up to flexing your entire body, and make sure each section of your body you flex, the entire muscle group is flexing. Just like you want all the fingers to flex hard, you want your full bicep engaged, full tricep, etc.

It's hard to feel it all and hold the flex everywhere at once at first, but as long as you are putting in the effort to flex hard and just hold it as you hold on to the pullup bar while gripping it to death, you will gradually get better at it.

Believe me when I say the difference between controlled full-muscle flexing, and not flexing, while working out, is beyond the difference between night and day. 

Besides a cheap pullup bar for 15 bucks, the only other thing you'd want is a spot on the floor to do a pushup, and a bed or chair or anything to at least slightly elevate your feet above you. Then just practice either making a flexed fist or an open palm, and work on either holding the fist tight without letting the floor and the weight force your hand to crumble and cave in on itself, or work on getting your fingers to all press together in the open palm position as if you are trying to make your fingers do pushups as well.

You can even get on your knees and then use all 5 fingertips on each hand to hold yourself up, and do fingertip pushups. Make sure to press with every finger, especially the pinky and ring. Hold the pose or do pushups.

In just days you will feel so much more powerful, flexible, clear headed, motivated.

Trust me, exercising and putting effort in to flexing/extending all of your muscles releases so many good hormones and stuff, improves your circulatory system, burns fat all over the body more evenly, everything gets better.

It helps with adhd, depression, insomnia, etc. 

Last one. Buy any cheap pair of dumbbells, even a pair of 5 lbs would be perfect, especially 5 lbs. Because right off the bat you can move your arms in any direction and workout your shoulders.

Most important muscles in the arms are first the hands/forearms, the shoulders, and then the tris and bis.

Do arm rotations and every other shoulder exercise you can youtube with those 5lb dumbbells, while choking the fucking life out of them.

Your shoulders and deltoids and shit will feel way more powerful, and your arm sockets will get more cushion.

And then don't forget to once in a while drop all the weights, and just smoothly swing your arms, torso, legs, etc in every direction, while focusing hard on flexing them as you move them.

And do all the movements from your hips and core muscles, not your hands. Punch and swing from your body, not your arms.

Try to swing your arms left and right using only your torso, but then gradually use your arm muscles to go with those movements.

Gradually increase and decrease the range in which you swing your torso left and right. You'll go from full horizontal windmills, to rapid wushu punches.

And hold a flex while you do it. You'll feel your arms and torso get powerful and lose.

Eventually when you become decently fit, do it with those light dumbbells.

And then squats and deadlifts, just with the lightweights.

Keep the movements smooth, controlled, muscles flexed. When you speed up and you are doing negative reps, like dropping in to a crouch, drop with gravity or even drop faster, but learn how to smoothly decelerate as you go down and back up, accelerate in the middle, and decelerate.

You basically want to accelerate in the middle of your range of motion, and decelerate smoothly as you reach either end of the movement. That helps keep things from being damaged, but holy shit does it stimulate those muscles. It's basically a mix of dynamic stretching and warmups. Resistance cardio basically.

Honestly, resistance cardio, if done right, is the champion of all exercise routines.

Jog with 3 lb weights in your hands, and learn how to gently land and gently bounce off, like you're a spring.

Always try to do your reps like a spring. Quickly in the middle but smooth and slower as you hit each extreme. Like how people jump on trampolines. That's how all movements should look, springy, but controlled.

Any one of you can tremendously increase your strength and endurance and flexibility and energy and focus and happiness and self confidence, with even just a pair of 5lb dumbbells. But also get the pullup bar and do pushups, or even just hold pushups.

Trust me, any one of you can quickly quickly make gains, with light weights, if you just do a variety of movements or holds, and flex through all of the motions or holds.

It will change your life and you will love it.",t3_9xbawu,CaptainMcSpankFace
147,eay7p8s,e9rh8qh,This is peak r/actlikeyoubelong,t3_9xbawu,reallifelucas
148,e9riqad,e9rarry,You can also increase the volume on all of them just before your departure.,t3_9xbawu,anticlockclock
149,e9s0z5n,e9rarry,Pulling out the plug at the back and mimicking the beep noise as staff look on with a grumpy face,t3_9xbawu,ieatdoorframes
150,e9rj3hi,e9rarry,HOW?,t3_9xbawu,ApocalypseBride
151,e9svfrl,e9r7wov,"Circa 1978; I saw an ad in the back of what was then called a nudie magazine. it boasted ""the most powerful placebo on the market."" That shit is hilarious.",t3_9xbawu,Cheeseand0nions
152,e9septv,e9rh4h2,My friend is a janitor at a pretty new school. (Not much broken stuff) so on his down time he walks the building rather quickly with what ever tool he decides. The teachers and staff always think he’s going to fix something. Lol,t3_9xbawu,
153,e9sg8hh,e9rh4h2,"My husband's boss would always complain to him that he never had enough documents with him when he attended meetings, he now takes in random folders and a stack of papers which he will, occasionally flick through or reshuffle, boss is happy as Larry with hubbys improved performance in meetings.",t3_9xbawu,FlaredFancyPants
154,e9sf1rn,e9rh4h2,"I've been doing exactly the same thing at different jobs for years! Pro tip: if you notice that someone is eyeing you suspiciously , walk to the nearest printer and complain under your breath about how it never works like it's supposed to",t3_9xbawu,WiseAvocado
155,e9sen2v,e9rh4h2,"Use a clipboard and walk real fast, nobody bothers the clipboard guy",t3_9xbawu,StaglBagl
156,e9rofo9,e9rbg3c,"This is the caliber of post I was expecting. Actual cheat codes. Not “be nice to your family and, surprise, they won’t hate you!” Thank you",t3_9xbawu,deltarho
157,e9s0a6j,e9rbg3c,I need a diagram ,t3_9xbawu,VanellopeEatsSweets
158,e9ru2ew,e9rbg3c,I’m glad I didn’t know about this as a kid / teen. I would’ve done it til I got caught. Now I’m like... I’m not gonna be a 31 year old dude who catches a felony over $5 in quarters. My friends would never let me hear the end of it.,t3_9xbawu,Funky_Sack
159,e9rjutt,e9rbg3c,r/UnethicalLifeProTips,t3_9xbawu,Sykes92
160,e9s5zfn,e9rbg3c,"this is the kind of shit u dont share with anyone if it works
cuz people will exploit the fuck out of it until it doesnt work anymore",t3_9xbawu,RosemarysFetus
161,e9rwoz9,e9rbg3c,Wait... does this really work?,t3_9xbawu,BAGP0I
162,e9ryc92,e9rfwc5,"*I've befriended the most disliked, crotchety person in our office.*

This. 

Find the grumpiest person that you work with and give it 100% to be their friend. You usually find they’re only that way because of social anxiety, and are actually great people.",t3_9xbawu,batmanbatmanbatman1
163,e9rah4i,e9r61cn,How does one unlock said skill? I dont see it in my tree.,t3_9xbawu,Natekid99
164,e9rvagf,e9rey9o,You probably caused mini heart attacks until they realized you wanted the manager for good reasons. ,t3_9xbawu,Dontthrowawaymylove9
165,e9rzc0k,e9rey9o,"Works for call centers too. You don't usually get stuff, but talking up the person that just solved your problem while you were being an angsty dick to their manager might well get them a well-deserved bonus. ",t3_9xbawu,fectin
166,e9s5aow,e9rbr6h,What a power move,t3_9xbawu,hugh_calyptus_
167,e9sfs60,e9rbr6h,"I heard a story of a lawyer doing it while giving a closing argument in trial. He farted, looked up at the judge, and said “strike that from the record.”",t3_9xbawu,randallstevens65
168,e9s5w8s,e9rbr6h,"My fav line for this is ""did you hear that asshole talking shit behind my back?"" first time I heard it I was in tears. ",t3_9xbawu,watersofserenity
169,e9s78v5,e9rbr6h,Funny! A professor of mine ripped one in class and kept teaching like it didn’t happen. Not going to lie I was in tears after class ,t3_9xbawu,tstx128
170,e9rtd69,e9rbr6h,Omfg I’m trying this next time!,t3_9xbawu,Dr_Stef
171,e9s5v13,e9rbr6h,"Something similar: if your voice cracks when giving a speech, repeat the last phrase in a super low authoritative voice with a hint of humor.   It will go over well. ",t3_9xbawu,craigertiger
172,e9s7fsk,e9rezhn,"I’m at a tattoo studio right now and I asked the 300 pound, intimidatingly tattooed owner of the shop if he knew the words to I’m A Little Tea Pot...

Without hesitation he started reciting it while doing the pantomimes. 

Impressive. 

",t3_9xbawu,
173,e9rtpwy,e9rezhn,[deleted],t3_9xbawu,
174,e9rulm6,e9rezhn,"Do you know all the words to ""I'm a little teapot""?",t3_9xbawu,praise_the_god_crow
175,e9rytg4,e9rezhn,The other 20% have convulsions on the floor,t3_9xbawu,ieatdoorframes
176,e9s1z3i,e9rezhn,"Similarly, ask someone what a goatee is and they'll start rubbing their face.",t3_9xbawu,alternative-username
177,e9riz75,e9r5rro,What do you mean by wave in a circle?,t3_9xbawu,TheCanadianEmpire
178,e9rp7xb,e9r5rro,"Reminds me of a video I saw of a farmer that knew a certain chicken language to make them all hide under a tree

Edit: https://youtu.be/12T3exSPKSM",t3_9xbawu,Twirlingbarbie
179,e9rozng,e9r5rro,How the fuck did you find this out....?,t3_9xbawu,tuhgttg
180,e9rect1,e9r3edw,"To add to this, someone's opinion blog isn't research. ",t3_9xbawu,rustyxj
181,e9s06lw,e9r3edw,"When doing your own research, don't search for things that agree with you.  Instead, search for claims *against* your position.

Consider the bias of your sources, but don't immediately reject something just because of the source.  CNN and Fox News both spin things in different directions, but that doesn't mean either of them are complete lies *all* the time.",t3_9xbawu,Sohcahtoa82
182,e9rvz4v,e9r3edw,"You're not wrong, but people often suck at research, do it anyway because they don't realize they suck, and end up becoming antivaxxers or something.",t3_9xbawu,wardsandcourierplz
183,e9r4cp2,e9qz7q2,Reminds me of George on Seinfeld when he acts like he's always annoyed so everyone assumes he's working hard. ,t3_9xbawu,howsthatassfeelin
184,e9r5qmp,e9qz7q2,"Also carry two full sacks. That way if anyone asks for help, say ""sorry, I have these sacks"".",t3_9xbawu,stalkholme
185,e9r28kk,e9qz7q2,"Also, equip a lab coat and clipboard and act like you belong. You can suddenly go wherever you want.",t3_9xbawu,Sedifutka
186,e9reywq,e9qz7q2,Always walk with papers. Learned that in the army. No one tries to grab you and task you out to some random BS if you look pissed off and have some papers,t3_9xbawu,DestroyerOfWorlds831
187,e9ragn3,e9qxsa9,"I've always wondered, what exactly do you *do* once you get backstage?",t3_9xbawu,PhoenyxStar
188,e9r9thb,e9qxsa9,"My dad worked as a line mechanic and kept his hardhat into management in his trunk. I asked him why, and he said ""you can go anywhere with a hardhat and a tie."" 

Also, I delivered pizzas, and although I never delivered to a concert, security was incredibly lax when I needed access to areas that were restricted (there was actually a delivery though.)",t3_9xbawu,notalaborlawyer
189,e9r7o61,e9qxsa9,I’m a pizza guy. The only people that stop me are the stingy old people who won’t let me go into the apartment building as they come out because “that’s the rules” and I “have to be buzzed in” ,t3_9xbawu,BenV17
190,e9rab51,e9qxsa9,"Also,  if you're trying to get better seats at a show, go get 2 beers and carry one in each hand. No one checks your ticket when carrying 2 beers. When they ask just look at your beers and shrug your shoulders. Then find some better seats. Works 100% of the time, 60% of the time.",t3_9xbawu,punchin_mr_clown
191,e9rbp8z,e9qxsa9,"You gotta get one of those thermal bags though, I used to deliver pizzas and those things are an entry pass to ANYWHERE.

Some guy holding a pizza vs a guy holding a pizza in one of those thermal bags? Way more convincing",t3_9xbawu,nightbefore2
192,e9rs1dk,e9r7rmr,"I’ve started going with “Thank you, that’s nice to hear”",t3_9xbawu,tb1649
193,e9rwgk4,e9r7rmr,"""Thank you, it has pockets!""

You remind me of my sister.. I think it's so funny how happy women seem to be with pockets in dresses.",t3_9xbawu,Moochingaround
194,e9ru4b5,e9r7rmr,"If you really believe you just blew something like a performance, and someone compliments you, then say, “Thank you, you’re too kind!”  Learned that from my college choir conductor. ",t3_9xbawu,theflyinghillbilly
195,e9r544n,e9qwl7t,All good and well until some kid flexes their sitting muscles too hard and suddenly you've got a poopy pants emergency.,t3_9xbawu,greengrasser11
196,e9r4mmb,e9qwl7t,"My first school had the concept of different hats, so if you were told to put your ‘listening hat’ on, you would pretend to put a hat on and it was time to listen. Worked a dream.",t3_9xbawu,absolut_bovka
197,e9r395c,e9qwl7t,"Ah, the old exploiting human brutishness trick.  That's a good one, teach!",t3_9xbawu,
198,e9r3mip,e9qwl7t,Holy shit I love this. Trying it on my 3 year old ASAP. ,t3_9xbawu,diggitydizzarci
199,e9ribp1,e9ram90,"Can confirm, was told I was smart as a kid, terrible worker

Edit: I don't mean to confirm this as causation, just my experience ",t3_9xbawu,ChamedUp
200,e9rf41o,e9ram90,"This is growth vs fixed mindset, for those wishing to investigate further, and it is rock solid legit science. ",t3_9xbawu,willworth
201,e9rinhv,e9ram90,"can confirm, grew up being told was smart, am actually lazy idiot ",t3_9xbawu,
202,e9rmqeg,e9rci5v,"Man, you know way better kids than I do.  ",t3_9xbawu,rowdyanalogue
203,e9rvigi,e9rci5v,"I'm calling bs on this one. 

Source: was lifeguard for five years. 

""Walk please!"" gets almost no play. 

""STOP RUNNING!"" catches their attention only about half the time. 

**""RUN FASTER!!""** will almost always make them stop and look at you quizzically, as they're not used to adults encouraging horseplay. Once you've got their attention through this method, you can tell them to walk. ",t3_9xbawu,chadonsunday
204,e9rrltq,e9rci5v,Unless that kid is yours and inside the house. Ugh... ,t3_9xbawu,matrem_ki
205,e9r8v5z,e9qymmx,"A pretty wise ex drug user I worked with once told me, ""If you hang around the barbershop long enough, eventually you're going to get a haircut."" Basically, watch the crowd and the activities you surround yourself with.",t3_9xbawu,WutangCND
206,e9r44vw,e9qymmx,Guess I'm a nobody. ,t3_9xbawu,D45_B053
207,e9r8lst,e9qymmx,"This is the biggest one for me. I've seen too many smart kids go down he wrong path just because they hung out with idiots. Inversely, I've seen idiots become pretty successful just because they hung around encouraging, smart kids. ",t3_9xbawu,lyciann
208,e9ratnb,e9qymmx,"I've used this in the workplace to great effect - just focus on surrounding yourself with people who are better than you, and you get better yourself.",t3_9xbawu,PublicSealedClass
209,e9rjiu6,e9r76je,"I like this one. I have found myself making up elaborate stories to explain why I couldn't attend an event or something. Just be brief, honest, and to the point. ",t3_9xbawu,rufusvonburon
210,e9rjykl,e9r76je,This was a hard lesson for me. I'd like to add to this that no is a complete sentence. Offering reasons for not doing it are often an opportunity for the other person to examine/decide if your reasons are good enough. ,t3_9xbawu,tantors_sin
211,e9rk7vn,e9r76je,"This is one I am currently learning, I can just tell coworkers that ""No I can't cover your shift"" and it's enough. On the other hand, people like the guy who will almost always cover shifts.",t3_9xbawu,TheHotze
212,e9qyqv6,e9qvo4c,"And the opposite of that is the Socratic method, when someone says something (you think is) wrong, ask them questions to see why they believe, there's two possible outcomes:

* They end up explaining it via some contradiction or ridiculous assumption, and the belief probably was wrong. And getting them to explain it increases the chances they'll [actually change their mind](https://www.newyorker.com/magazine/2017/02/27/why-facts-dont-change-our-minds)
* They actually do explain it, it makes sense, and I learn something new

Either way it's important to remember that a good definition of ""rational"" is ""trying to prove yourself wrong"". If we want to make smart choices and have accurate beliefs we have to challenge ourselves and at least try to weed out all the wrong beliefs before they become dumb choices.",t3_9xbawu,PM_ME_UR_Definitions
213,e9qzeta,e9qvo4c,"""I love you.""

""You're right.""",t3_9xbawu,whoamreally
214,e9qvr5h,e9qvo4c,You're right!,t3_9xbawu,SunZuu
215,e9r05ap,e9qvo4c,[removed],t3_9xbawu,
216,e9r9dd5,e9qxjfe,"I've mastered the ""basic acknowledgement"" skill. 

Someone will inevitably say something that on it's own, means nothing. They're implying something, but it's often effective to just get them to say it out loud. Sometimes, it's the buffer between ""just do it"", and ""that sounded more intense than I thought"". 

""Okay...."" in that ""go on"" kind of tone.",t3_9xbawu,movingtarget4616
217,e9rbez5,e9qxjfe,"The old quote remains true, ""It is better to remain silent and be thought a fool, than to speak and remove all doubt."" I've been in a number of meetings where someone thought they needed to talk to be seen as credible, but they got ahead of themselves and sounded foolish instead.  If you've nothing of substance to say, say nothing.",t3_9xbawu,forkmonkey
218,e9r47ww,e9qx04a,Yeah I’m going straight for “100percentoff” and working my way down from there. ,t3_9xbawu,Zombie_Nipples
219,e9r67ul,e9qx04a,[deleted],t3_9xbawu,
220,e9r5zo8,e9qwzt8,"the best advice I ever received was from my grandmother. I was a talkative child and would ask questions nonstop. When I apologized for asking so many one day she looked me straight in the eye and said ""NEVER stop asking questions""",t3_9xbawu,Liesl121
221,e9r9bs7,e9qwzt8,"This has been my biggest challenge.  Growing up I was always the 'smart kid' and my identity felt tied to inherently knowing things, or being able to infer things, that my peers didn't.  Then I went to university and I think I missed out on a lot of academic knowledge, friendships, professional contacts, because my default was to not ask questions.  Someone would use a weird acronym and I would just nod along, trying to remember to google it later so I wouldn't look like an idiot.  It still doesn't come naturally to me, but now that I'm working, I work very hard to engage in conversations more often. ",t3_9xbawu,_mariguana_
222,e9r99qz,e9r26mp,"also toss your jeans in the dryer for 15 minutes on a cold morning and you will have similarly warm jeans, it's a nice perk if you have guests over too",t3_9xbawu,deepsoulfunk
223,e9r319c,e9qw9vh,"Been doing this for years. I’ll plan large purchases from Amazon or Home Depot around their 4x fuel points so I can get the gift cards. 

EDIT: This also includes Kroger stores that operate under a different name (i.e. King Sooper’s)",t3_9xbawu,hero807
224,e9r9f4d,e9qw9vh,"For Canadians, abusing PC optimum points at Shopper's Drug Mart is similar.

Go to one on a weekend when they have their ""20x the points!"" promos, and just buy things you would usually buy, at prices you would usually pay (or less), adding up to the minimum purchase of $75. No need to go crazy. Just make this your usual time for stocking up on non-perishables (toilet paper, paper towel, etc), pills (ibuprofen, cold meds, etc), and other shit you can keep until you need it.

Then, go to their ""point values are doubled!"" promos and reap what you sowed.

I've gotten 4 Xbox One Wireless Controllers at no cost by doing this.",t3_9xbawu,Oafah
225,e9ra4gr,e9qywpd,All of my courses now require an online code to do the mandatory homework assignments... Which you can only try by buying a textbook full price. (or you can buy just the code for $20 less! So only 130 instead! How generous!) ,t3_9xbawu,Duraken
226,e9r6an6,e9qywpd,You can contact the author of a journal article directly and they can send you said article for free. They don't see any of the money it would cost you to subscribe to the journal.,t3_9xbawu,
