,comment_id,comment_parent_id,comment_body,comment_link_id,comment_author
85,e9r1c4a,9xbawu,"Want to be more attractive? Look like you take care of yourself and work on an attitude where you don't care so much what other people think or do. That's a lot of it right there.

As for the look, just be in decent shape, have good hygiene including a good and well-maintained haircut, and wear clean clothes that don't look old and are reasonably adult in style. For the attitude, you want to be relaxed without being lazy. Don't sweat the small stuff, but talk to them about the big stuff right away. Listen rather than just waiting for your turn to talk. Get to know people at whatever pace is good for them, don't force things. See people for who they really are, not who you want them to be or what they can be for you.",t3_9xbawu,zazzlekdazzle
86,e9r0w6x,9xbawu,"""Ctrl+F"" or ""Command+F"" on a computer

It gives you the power to easily find any keyword or phrase on the page. 

However, it has the side effect of ruining your ability to visually scan a physical document.",t3_9xbawu,DrCrentistDMI
87,e9r8xk4,9xbawu,[deleted],t3_9xbawu,
88,e9r6nx8,9xbawu,Farting then smelling your own farts will create an immunity to them.,t3_9xbawu,
89,e9qy19a,9xbawu,Squat ,t3_9xbawu,ElMel77
90,e9rdxxy,9xbawu,"This world is built on expectations. There's basically two types; the ones you have and the ones you set for others. The first type you should evaluate and make sure they're reasonable; not everyone becomes a billionaire (although you won't become one without trying). The second type is even more important. If you set other people's expectations to high, you might not meet them and you'll seem like you failed. It's better to set them (a little) low; that way you can outperform them and seem exceptional. Just don't set them too low or people might not respect you enough to even let you try.  

Tl;dr: Master expectations--> Master life!",t3_9xbawu,mentu1
91,e9r2hxb,9xbawu,"Your likablility rating is infinitely more valuable than your intelligence score. Invest those talent points in looking good,being on time, and generally being fun to be around. You'll cruise past those int stacking assholes in no time. ",t3_9xbawu,biggman57
92,e9r9t8i,9xbawu,[deleted],t3_9xbawu,
93,e9rcozt,9xbawu,"If you sell drugs:

1. Don’t look like you sell drugs: no gold chains, baggy cloths, flat caps, weed shirts, legalize it bumper stickers, etc. Dress like a background actor. 

2. Normal car, not too nice, not to shitty where you’ll get pulled over. 

3. Never smell like drugs. 

4. Have a job. One that works on tips would help ;). Find a way to pay taxes on your money, the IRS doesn’t fuck around. 

5. If someone seems sketchy or like a cop don’t do the deal.

6. Last but not least, if you ever get caught you’re out of the game. Judges might be chill the first time if you’re lucky, but never the 2nd and 3rd.
Also, the cops know you sell drugs now...so... the gigs up.
",t3_9xbawu,Talltoddie
94,e9qybjt,9xbawu,Press on your taint to get the last drops of piss out after you're done urinating.  The gooch button.,t3_9xbawu,zangor
95,e9qvnt6,9xbawu,"Spend a lot of your time on Sunday making sandwiches for the rest of the week, then you're prepared ya turkey!",t3_9xbawu,hiddenuse
96,e9r80uk,9xbawu,"When watching the news, if they show you the thing happening, believe it. 

If they are talking about a thing happening, don't believe it. 

It's 2018, everyone has 1080p cameras in their pockets. If it isn't being shown to you it is bullshit. ",t3_9xbawu,
97,e9rfeho,9xbawu,Postage paid return stickers from spam companies are sometimes no limit. Attach a brick to that shit and send it to them on their dime,t3_9xbawu,
98,e9qvvtq,9xbawu,Shout out to /r/outside. ,t3_9xbawu,showmm
99,e9ri19h,9xbawu,"If someone tells you they have pierced nipples, they want to show you they have pierced nipples.",t3_9xbawu,might-be-a-dog
100,e9r8u99,9xbawu,Having rich parents,t3_9xbawu,Tkkool7
101,e9r7j2y,9xbawu,"If you work in a place for 8 hours a day, five days a week, at the end of a month money appears in your bank account.",t3_9xbawu,TheMightyCephas
102,e9r15ul,9xbawu,"If you want to tell someone HEY FUCK YOU but can't because you'd get in trouble for it cause you're like at work or something, you can just say ""bless your heart"" instead and it means the same thing.",t3_9xbawu,DaveDavidsen
103,e9rcv0p,9xbawu,"Portable power bank cell phone charger in my car.   
  
Basically I got tired of my cars slow speed of charging my phone off the cigarette lighter.  
 So I bought a 10000 mah power bank with fast charging capability. I plugged it into my cars cigarette port so that whenever my car is on its charging. Then I just plug my phone in for a fast charge on the road and the power bank might go down but will gradually recharge over time when my car is on. 
  
So basically it's as if I created a sort of water tower but for power. I was unhappy with the speed at which power was coming in so I installed something to let it build up pressure and speed up the flow.   
  
Another bonus is that it can be easily removed and taken with me. So if I am at say a restaurant and need to charge my phone I can take it in with me and continue the charge. 
",t3_9xbawu,nuck_forte_dame
104,e9r1a17,9xbawu,Use a spoon instead of a knife to spread stuff on bread! Everyone mocks me for this but as soon as they try it they realise how much easier it actually is.,t3_9xbawu,TheBrokenJoker
105,e9r5r9l,9xbawu,"create a visible tell for when you are lying, ie, looking around, scratching your lip etc..

and then drop some little white lies while using this tell, more playful than deceptive and get caught out and admit it (like move something of  then ""lie"" about it ""no I didn't move your coat"")

this builds up the tell in their mind, and they ""know"" when you are lying

then make sure if you ever have to lie to that person, you focus on NOT doing your ""obvious tell"" 
",t3_9xbawu,McDie88
106,e9qzloy,9xbawu,Stop watching TV and using social media. Increased mental well-being by 3x.,t3_9xbawu,VeterisScotian
107,e9r91ib,9xbawu,"If a product breaks long before it should have, but outside of the return policy - buy a new one and return the old one in the new one's packaging.

I did this with a kitchen appliance recently (fuck cuisinart).  It stopped working after 3 months.  The ""warranty"" required me to pay shipping both ways - equivalent to half the cost of the item.

So I bought a new one, swapped it, returned the broken one.  Retailer will send it back to the manufacturer.

Slightly unethical (I dont abuse this) but I am tired of buying products that seem to be designed to break.",t3_9xbawu,
108,e9r9em2,9xbawu,"Airport parking is really expensive overnight. Take an extra 10 minutes once you get back, walk to the ticket dispenser, print a new ticket and use the new one when exiting. Ive saved a considerable amount of coin doing this.
*this cheat code may increase your wanted level*",t3_9xbawu,non_est_anima_mea
109,e9rc8nb,9xbawu,"When someone tells you something or a story for the 2nd or 3rd or 100th time. Dont say ""Yea, you told me this before"" it sounds rude like you dont want to hear it. Say ""Oh, I remember you telling me this before"". If you say remember it makes it sound like it was important enough for you to put it to memory. Not you are bored with them.

Another one, try not to say I'm sorry, instead replace it with ""Thank you"". We say sorry a lot and it makes you sound like it's your fault. Instead of ""Sorry I'm late"" say ""Thank you for waiting for me."" Or ""Sorry I forgot"" say ""Thanks for reminding me"". It makes you sound appreciative of the person and no fault towards yourself. Obviously sometimes you have to say sorry but most instances you can shoot for thank you ",t3_9xbawu,Tauqmuk181
110,e9r6p2u,9xbawu,"When folding a piece of paper, lay it flat agaimst a surface, and push down across the crease with your fingernail. The fold becomes much cleaner.",t3_9xbawu,TPFRecoil
111,e9re6bk,9xbawu,"Networking is so important if you want a solid career in your industry. 

Being a ""known"" person really gives you a leg up in so many situations. ",t3_9xbawu,RikuKat
112,e9rg074,9xbawu,"Being nice and *present*. When someone is talking to you, give a shit. Listen to them, empathize with how they're feeling. Don't think about the meeting you have to go to, or how they're interrupting your day. ",t3_9xbawu,mattroffact
113,e9quwqg,9xbawu,Lying,t3_9xbawu,BondJesseJamesBond
114,e9r7dp1,9xbawu,"I like to book weekend getaways, the people I work with do Thursday night, Friday, Saturday come home Sunday. I leave Sunday, come home later in the day Tuesday, going into work Wednesday. Usually cheaper prices to stay and easier to schedule work coverage.  I get it if their is an event on the weekend, but often there isn't a specific event people are looking to go to and everyone fights over Fridays.",t3_9xbawu,I_Hate_This_Username
115,e9rffd7,9xbawu,"I used to work news and they gave us a large sign to put in our cars that read, ""On Assignment"". This would allow us to park basically anywhere we wanted without worrying about illegal parking tickets. I no longer work news but I still have the sign. I get to park pretty much anywhere I want to now.",t3_9xbawu,MEGADOR
116,e9r5wef,9xbawu,"Don't have any friends = cheap Christmas and you won't have to waste money or time on pesky social events!

Added bonus... you don't have to invent excuses to get out of said events as you weren't invited anyway!",t3_9xbawu,bunbuns07
117,e9r6r36,9xbawu,"You get more bees with honey than you do with vinegar. 

Don’t be a prick. ",t3_9xbawu,RedDevils_7
118,e9rf7ai,9xbawu,A dollar fifty for a Polish dog and a coke at Costco,t3_9xbawu,DustinDirt
119,e9rgu6r,9xbawu,"Grow a victory garden. It feels great to eat food you've grown yourself. Plus you've reduced your food insecurity. And it impresses people. Really, growing food isn't hard, it's just work. Delicious work. ",t3_9xbawu,-jspace-
120,e9s80uk,9xbawu,"I cannot stress this enough: all it takes is 20 seconds of mindless, insane, embarrassing courage to do something amazing in this world.

Just think about how often you decide not to do something because of fear! 20 seconds without thinking is such a small price to pay for what could be a lifetime of happiness. So go and do it, ask them out, give someone a compliment, tell someone you love them. A moment of clarity is so much better than a lifetime of regret. Take it from me. ",t3_9xbawu,TylerC52
121,e9sda84,9xbawu,"When applying for jobs, take the entire job description on the website and copy and paste it into your resume with white color and the smallest font size possible.  That way when the computer filters scan your resume you'll have all of the keywords to get passed the filter and in order to get a real set of human eyes on your resume, which is often the hardest roadblock to beat.  ",t3_9xbawu,
122,e9r7mn7,9xbawu,"Reducing carbohydrates and cut added sugars from your diet. Combine with at least moderate exercise and BOOM, weight loss ",t3_9xbawu,Spin_Me
123,e9rf2tk,9xbawu,Not having kids makes life much simpler. Remember people: having kids is a CHOICE. Don’t feel pressured to have them unless you’re completely sure. ,t3_9xbawu,PM_ME_UR_GLABELLA_
124,e9quvef,9xbawu,If you activate the cry interaction people will often be too startled and also eager to console you to pry too much into your business or scold you...works better if you have the female avatar and it is below average in stature ,t3_9xbawu,sweetpoison02
125,e9rc5jq,9xbawu,"If you’re in a rut, find a verb to describe what you’re **doing** instead of using the conventional  passive wording to describe your **condition**.  Some examples:

Instead of *I am depressed*, try *I am despairing.*

Instead of conceptualizing yourself as *having anxiety issues*, try *I’m freaking out.*

Instead of *I’m useless*, try *I am berating myself.*

This forces accountability on yourself and in doing so, opens up new options. Namely, “What are you going to do instead of the thing you’re doing now (that isn’t working so well)?”

Credit for hack goes to psychiatrist and author William Glasser.",t3_9xbawu,reed_wright
126,e9rdzr5,9xbawu,"Step 1.  Say yes
Step 2. Figure out how to do it ",t3_9xbawu,bnlbrts
127,e9r86zi,9xbawu,Do not discuss politics or religion with co workers.,t3_9xbawu,Fallouteffects96
128,e9r72az,9xbawu,"Losing weight is fairly easy if you are honestly tracking everything you eat and don't overestimate the calories you burn in exercise. I would recommend buying a cheap food scale because serving sizes as advertised tend to be a lot larger than serving sizes listed on the nutritional label, but once I got over that it was like I was on a ""calorie budget"" - I had 1400-1500 to spend a day, and there are a few food tracking apps that make it super simple to scan your food and go. I spent 6-7 years trying to get control of my weight, once I started actually logging it came off with relative ease. I wish I knew this earlier.",t3_9xbawu,
129,e9re7ec,9xbawu,The clit. ,t3_9xbawu,Poeticyst
130,e9rfesp,9xbawu,Up up down down left right left right B A and now you have a strain or sprain ,t3_9xbawu,TomFooleryFry
131,e9rg2h2,9xbawu,"it's really simple to help people who are having a hard time with life stuff.  

what the vast vast majority of people want is just to be heard and be validated.  

especially with your family, close friends, significant other, it's so easy to hear them complain about something and go, ""well, have you tried X?  Why don't you just Y?  Maybe you should Z.  You're thinking about this all wrong, it's really not X Y or Z, you need to Q.""  

Nobody wants that.  

A very simple ""Oh man, that sounds really hard.""  Or, if you're going for the dude-of-the-year award, a ""so it sounds like (repeat what they said they're feeling in simpler terms), is that right?""  and follow with ""oh man, i totally see why you feel the way you do.""

people light up like chrimmus trees when they're just simply validated and heard.  you don't need to solve anyone's problems, and by and large, people don't want you to.  they just want someone to hear them, and want to feel like what they're feeling is real, and that they're not being irrational or crazy.  

even if they are being a bit irrational or crazy, if you want to be a good friend, just hear them, validate their feelings, move on.  people will change when they want to change, not because you told them to.  ",t3_9xbawu,Gunntucky
132,e9r9prf,9xbawu,"If you're otherwise healthy (no underlying medical issues), yet generally feel sluggish or ""down"", drink water. Lots of people walk around dehydrated, and it really affects your health. ",t3_9xbawu,fskoti
133,e9r47o7,9xbawu,[deleted],t3_9xbawu,
134,e9r5keq,9xbawu,"Confidence, even if it's fake. If you're not so attractive, throw the confidence!! I'm not very attractive at all but I use that feminine confidence. Works like a charm!",t3_9xbawu,SomeFreakingWeirdo
135,e9rk7k7,9xbawu,"almost every light up gas station price sign has an outlet on it where you can charge a phone or laptop. 

&#x200B;

if you break a wal-mart trash compactor in the first week of december,  you get a gigantic dumpster full of thousands of dollars worth of christmas presents. 

&#x200B;

97.8 percent of all statistics are made up on the spot to win an argument. 

&#x200B;

duct tape and a mag light IS  a legal headlight. 

&#x200B;

dried strawberry leaves taste and smell enough like pot to make up a couple grams from an ounce.

&#x200B;

the smell of burnt gunpowder will scare off coyotes, even if its just a firecracker. (most of the time)

&#x200B;

you CAN drive on a used donut for more than 30 miles. its just not recommended. 

&#x200B;

cloves can sterilize a wound. 

&#x200B;

black pepper can staunch a wound. 

&#x200B;

sugar (white or brown ) will keep a severed finger re-attatchable for up to 6 hours, longer if frozen/chilled. 

&#x200B;

sugar (white or brown ) when packed en masse on the stump of a severed body part, can not only prevent you from bleeding out, but can also prevent shock. 

&#x200B;

bananas can help reduce seizures, arythmia and asthma attacks (never tested this myself.)

&#x200B;

salt sand and charcoal can filter water if you cant boil it. (doesnt stop everything, but saved me from giardia before.)

&#x200B;

drinking enough alcohol with 40% (80 proof ) or more can cure giardia. (quarter gallon or so.)

&#x200B;

shoe polish can help prevent wearing tires from popping until you replace them. (not for long and not very well but will buy you a couple miles.)

&#x200B;

any ball point pen + rubber band makes a decent little stabby shooter device, non lethal but can pierce skin. (not useful whatsoever)

&#x200B;

pouring whiskey on her vagina before having sex is a quick way to check for open sores. if she says it burns. wrap your tool. if she says its cold, probably good (not a 100% foolproof)

&#x200B;

severed dreadlocks make excellent signal fires. 

&#x200B;

helium balloons tied to the ziploc bag is one of the most effective ways to ditch your stash. 

&#x200B;

rubber bullets prevent robberies just as well as real ones. beanbags and rock salt too. 

&#x200B;

maxi pads are a great way to slow the bleeding until you can get to a hospital.

&#x200B;

most robbers dont like being driven to a hospital with maxi pads stuck to them. 

&#x200B;

taking ipecac can get you out of PT/work .

&#x200B;

smoking 2 or 3 rollies of lavender will make you shit liquid rather quickly. 

&#x200B;

no matter how big or bad you think you are, getting hit in the neck, sternum, knee or ankle with a hard object will immobilize  you for at least 30 seconds. 

&#x200B;

leaving a dead rodent or rabbit on your porch will usually dissuade mormons or jehova witnesses. 

&#x200B;

you dont have to file taxes if you make less than $20k a year.

&#x200B;

as long as it is all cash transactions with no reciept, the IRS cant prove shit, and they will lie to scare you about it. 

&#x200B;

most nerf guns are more fun if you replace the dart tips with rubber eraser caps and some glue. 

&#x200B;

fritos are very flammable and will burn very hot for quite some time. 

&#x200B;

dark chocolate creates the same chemical balance in the brain as being in love.

&#x200B;

you can use an NES coax cord on SNES, sega genesis, and PS1(grey box original).

&#x200B;

the wire from a survey flag (little orange flag on gaslines as such) is the best tool for cleaning a bong. 

&#x200B;

holding your finger about an inch away from someones face and saying ""im not touching you"" is not legally assault. 

&#x200B;

most trains will stop about a mile up the track if you place a conductive metal rod/wire across both rails. good tip if stuck in wilderness and need a ride to civilization.

&#x200B;

ostracizing racists is  a great way to prevent racism. 

&#x200B;

cornflakes and dawn dish detergent in rain/sprinklers will require up to a foot of sod to be replaced. and it stinks to high heavens.

&#x200B;

most dogs will release their jaw if they have a broken rib or a plugged nose, or a finger in their asshole(deep, hooked and pulling helps). 

&#x200B;

typing constantly will wake up your significant other.",t3_9xbawu,pythonic_nonsense
136,e9r8i5t,9xbawu,"Randomly punch any old phone buttons during automated phonecalls and they'll put you through to a real person, deeming you incapable of using the robot interface.

Works every time.",t3_9xbawu,Woodcharles
137,e9r9xvf,9xbawu,"When I was an attractive teenager, people treated me way better now than I'm an ugly adult, so don't be ugly.",t3_9xbawu,AsperaAstra
138,e9qwupl,9xbawu,I think not having kids is pretty practical.,t3_9xbawu,MansonsDaughter
139,e9r9ybk,9xbawu,never use Comic Sans MS in a work setting ,t3_9xbawu,theexpeditionist
140,e9r5sip,9xbawu,rosebud,t3_9xbawu,howdoiredditit
141,e9rbggx,9xbawu,"I'm a woodworker and I've learned that the only sure fire way that I'll put my eye protection back on before making dust is to put them down on the actual tool. If they're just on the table, I might not think about them but if they're on top of the router or in the path of the saw I'm using, grabbing them to move them is enough of a trigger to put them on",t3_9xbawu,flwrchld77
142,e9re89k,9xbawu,Marry into money so you don't have to work for it ,t3_9xbawu,NigTransMarxFemJew
143,e9ra2xp,9xbawu,If you walk in assuming you'll own the room you probably will. ,t3_9xbawu,skilganon
144,e9rgwx6,9xbawu,"If you want a better price on television or internet service - call the 800 number of the company and ask to speak to the retention department. If you get a male, hang up and try again. If you get a female, politely tell them you were offered another deal at X company and provide a lower price. 8/10 times the company you are dealing with will get you a better deal. If it fails, tell them you are planning on cancelling all services... this will really increase your chances as the retention departments goal is to keep customers... sometimes they even get a commission for this service.  - Signed, an ex-comcast Employee who is male and never gave discounts.",t3_9xbawu,anticlockclock
145,e9rfiwh,9xbawu,"If you are a creative person and have found yourself in a ""writers block"" or something similar, try cleaning up your house or do that thing you've been putting off. I find that if I'm productive in other aspects of my life it carries over to my music.",t3_9xbawu,ApocalypticMeatloaf
