,comment_id,comment_parent_id,comment_body,comment_link_id,comment_author
0,e9rh8qh,9xbawu,"Several times in life I've cold called a company to confirm my interview time. I didn't have one prior to my call, but in their confusion and inability to even find my resume I've managed to secure an interview about four out of five times. Twice I've gotten the job.",t3_9xbawu,TickleMeStalin
1,e9rarry,9xbawu,You can mute the self check-out kiosks. ,t3_9xbawu,thewilburbeast
2,e9rfne7,9xbawu,"Smiling is fucking magic. 

* You can hear a smile through the phone. (and of course people can see it on your face)

* People often return a smile with a smile, which spreads positivity.

* Smiling can actually make you happier, which is a nice feedback loop to be in

* Fake it 'til you make it, smiles and confidence will open doors for you in life.

https://www.neuronation.com/science/benefits-of-smiling  

",t3_9xbawu,takes_joke_literally
3,e9r7wov,9xbawu,"When my daughter was little and still believed band-aids cured things, one time she had a belly ache so I put one on her belly and it made her feel better. Power of placebos!",t3_9xbawu,tres_chill
4,e9rh4h2,9xbawu,"When I was in my old 500+ person building, I kept a stack of papers on my desk.  When I was bored, or got tired of sitting down, I'd get up, grab my stack of papers and walk around.  I called them my ""walking papers"" and did this for months. Got a lot of head nods and not one question the entire time. People always assumed I was on an important mission, but nope. Not in the least. 

PS: worked on the executive floor / wing, too. ",t3_9xbawu,37214
5,e9rbg3c,9xbawu,"Take a 1 dollar bill and flip it over. Now tape a 5 dollar bill and tape it to the end of the upside down single with as little tape as possible to make it secure. Now feed the five dollar bill into a change machine. The coin machine reads the five, gives you quarters, then reads the upside down single, rejects that, and boom, you got yourself a felony.",t3_9xbawu,BodhiMage
6,e9rfwc5,9xbawu,"Niceness gets you everywhere. I get free shit from being nice. And no, it's not because I'm a cute girl. Because I'm not. I'm an overweight, balding man. People respond to niceness. I've befriended the Comcast customer support person. I've befriended the most disliked, crotchety person in our office. I get special treatment at my cafeteria because I treat the service staff like actual human beings. I get fees waived because I asked nicely.

Be nice. It costs little and is worth a lot.",t3_9xbawu,boundbythecurve
7,e9r61cn,9xbawu,Once you unlock ‘not giving a fuck about other people’s thoughts’ you basically double your mana indefinitely. ,t3_9xbawu,Pfeiferrm
8,e9rey9o,9xbawu,"If you have no complaints about your food service/staff at a restaurant, ask to see the manager and pay a **compliment** and a ""thank you"" about the server/host/staff. Usually people want to see a manager to complain, and a compliment is nearly always welcome. 

I've gotten countless free drinks/appetizers/chips/% off my bill - all for just making a polite comment to management. 

Edit: Thanks for the Reddit Gold, kind stranger! ",t3_9xbawu,heelstoo
9,e9rbr6h,9xbawu,"I had a professor in college who, while lecturing, suddenly let out a *huge* fart. Without pausing, he turned his head as if talking to someone behind him, said ""Gesundheit,"" and continued lecturing as if nothing had happened.

It immediately ~~diffused~~ defused any potential awkwardness and embarrassment, and I vowed to use the same strategy if the same thing ever happened to me in front of a large crowd of people.",t3_9xbawu,KnowsAboutMath
10,e9rezhn,9xbawu,"Not a cheat code, but an Easter egg:

If you ask someone if they know ALL the words to “I’m a little teapot” around 80% of the people you ask will start singing it. 

Half of those will do the gestures. ",t3_9xbawu,InsertPlayerTwo
11,e9r5rro,9xbawu,"If you tuck a chicken’s head under its wing and wave the chicken in a circle, it will automatically fall asleep. It’s not a very good cheat code, but it’s still a cheat code to get you sleeping chickens.",t3_9xbawu,HoboTheDinosaur
12,e9r3edw,9xbawu,**Doing your own research** especially on the important stuff. You would be amazed about the bad information people use to make life choices. ,t3_9xbawu,retrogradeprogress
13,e9qz7q2,9xbawu,"Walk with a purpose.  For some reason, people think you're busy and you don't get hassled.  ",t3_9xbawu,Just_Curious_Duder
14,e9qxsa9,9xbawu,No one stops a guy or girl carrying a pizza. It can get you backstage to concerts. ,t3_9xbawu,tenderbranson301
15,e9r7rmr,9xbawu,"The correct response to any compliment is ""Thank you."" You can then follow it up with a comment if you'd like to continue the conversation. If someone likes your dress? ""Thank you, it has pockets!"" If someone compliments your art? ""Thank you, I've been practicing."" If someone asks if you're a professional singer because you have a good singing voice? ""Thank you, I just sing for fun.""

Not only does it make you seem confident and self-assured, it tells them that they are right!  That's a friendly thing to do.

This even works if you don't believe the compliment.  Saying, ""Oh, no, I'm ugly,"" when someone compliments your appearance not only tells them that they're wrong, it makes you think of yourself as ugly. A better answer would be, ""Thank you, I really appreciate that and I don't always believe it, so hearing that from you helps.""",t3_9xbawu,insertcaffeine
16,e9qwl7t,9xbawu,"I am an assistant teacher in a preschool. Asking if kids can use their sitting muscles and listening muscles during circle time makes the kids want to show me how ""strong"" they are.",t3_9xbawu,neurotica_9000
17,e9ram90,9xbawu,"Compliment your children with ""you are a hard worker"" and not ""you're smart"". Studies show that kids who think they're hard workers outperform kids who think they're smart.",t3_9xbawu,holy_hunk
18,e9rci5v,9xbawu,As an adult you can tell almost any kid who is running to stop running and they will.,t3_9xbawu,blankbeard
19,e9qymmx,9xbawu,You become the people you surround yourself with. ,t3_9xbawu,bk_cheech
20,e9rffw0,9xbawu,Sneeze on your knuckles before a fight to inflict poison damage,t3_9xbawu,portrick_manpower
21,e9r76je,9xbawu,"You don’t have to always “give away the recipe”.

By that I mean, don’t over explain yourself. If you can’t do something, 9/10 times it’s okay to simply say “unfortunately I’m not able to do that”, “can’t swing it this time”, etc. You don’t have to go on and on about *why*, or make up reasons and list them off.  Over explaining just ends up looking more suspect than simply being clear and concise. 

",t3_9xbawu,
22,e9qvo4c,9xbawu,"When someone says something true, say “you’re right”, not “i *know*”. It’ll make them feel better and you’ve still shown everyone how awfully clever you are.",t3_9xbawu,Taiwanderful
23,e9qxjfe,9xbawu,"The ""remain silent"" dialogue option is useful, even if you have to scroll down to find it. It can keep you from failing or getting locked out of certain quest lines. ",t3_9xbawu,Any_Move
24,e9qx04a,9xbawu,"If any website offers a percentage coupon code like ""10percentoff"" try higher values like ""20percentoff"", they often have them. ",t3_9xbawu,TheGarp
25,e9qwzt8,9xbawu,"Ask questions, about everything. Ask people about themselves. Be open about stuff you don't understand, and ask questions about that. When you forget someone's name, own up to it and just ask them. 

I am amazed at how many people won't acknowledge even a *tiny* amount of ignorance, or won't show honest curiosity about something, can't admit they've forgotten something they feel is important, and won't ever ask for help. Guys...your life becomes so much easier if you just drop the fucking ego and ask.",t3_9xbawu,tylerss20
26,e9r26mp,9xbawu,"I have a heated throw blanket in my living room- in the winter, I wrap my coat up in it , crank up the heat and in a few minutes, my coat is toasty warm so I can brave the coldest day.",t3_9xbawu,Lectric_Eye
27,e9qw9vh,9xbawu,"Get a credit card like AMEX Blue that has 3-6% cash back at groceries.

Buy all your items at grocery store. I'll use Kroger as an example.

You can buy normal groceries + gift cards (Amazon, Delta, H&M, McDonald's, whatever) and get the cash back on that deal. Then, if you time it with their 4x Fuel Rewards, you can save $1/gallon off gas up to 35 gallons.

Altogether, the math works out to being 12-15% off pretty much everything iirc.",t3_9xbawu,kukukele
28,e9qywpd,9xbawu,"You can borrow almost all of your textbooks from the library as a college student because of modern book rental agreements most colleges have.

WorldCAT allows you to be linked to almost any library in America, and all you have to do is find your book in the system and fill out a request form at a library and it should be there in a week. I’ve saved probably $2000 doing this in my first two years of college.",t3_9xbawu,exoticpike
29,e9r00d1,9xbawu,I cannot overstate how much dressing well and being well groomed will impact your life.  It'll drop the difficulty by two or three levels.  No joke.  People will treat you VASTLY differently.  The opposite is also true.,t3_9xbawu,Studlum
30,e9r6r1n,9xbawu,"When married don't stop treating your significant other like you did when you were trying to win them over, it is a great way to show them you're still as infatuated with them as you were when you first met.",t3_9xbawu,Knockemdeadkidd
31,e9qwile,9xbawu,"Pause- Like wait. when asked a question or engaging in idle conversation and someone is speaking do not immediately begin your reply when they stop speaking, they usually aren't done. ANd in the case of questions most people and finished and if you give them time they usually provide teh answer to the question as well, so yeah LISTEN as well.",t3_9xbawu,trollking66
32,e9rg31e,9xbawu,"As a doctor, I learned that earning grades, and learning are two different things.",t3_9xbawu,meninistMD
33,e9quzce,9xbawu,Not asking or talking about drama going on at the work place ,t3_9xbawu,WhyYouHating123
34,e9qye5k,9xbawu,Underpromise and Overperform. Say you'll achieve less than you think you will and then do more and everyone will be impressed (works well at a job),t3_9xbawu,Nrich5
35,e9qxayz,9xbawu,"If you're genuinely pleasant to be around and you show up when it counts, people will let you get away with a lot of slacking off.",t3_9xbawu,
36,e9qytzu,9xbawu,"Also, people like talking about themselves. When you meet someone just ask them questions about their lives or the things they've done - if you have enough questions you won't ever run out of things to talk about during the conversation and they walk away feeling sooooo heard. Plus, then you know more about them and next time you see them you will have even more to talk about or follow up on - ""hey last time I saw you you were mentioning this thing at your job, how did that go?"" etc. ",t3_9xbawu,Nrich5
37,e9r13ez,9xbawu,Faking confidence usually leads to actually being more confident. I love the phrase fake it till you make it. Its incredible how much success is a byproduct of just acting confident about whatever you are doing.,t3_9xbawu,captainpotatoe
38,e9r0r44,9xbawu,"To seem charming, all you have to do a lot of the time is to be an engaged listener. 

You don't need an amazing sense of humor, to be able to lay on the compliments or regale people with stories. Just listen to other people in a way that shows you are interested and not only waiting for your turn to talk - make eye contact, don't interrupt them, don't turn the conversation to be about you, ask good questions.

EDIT: I just want to add, as per many comments here, that being engaged listener is not the same as being a sort of conversational doormat where you have to allow people to drone on and on about things that don't interest you, annoy you, offend you, or drain you. Merely suffering through an encounter is pretty much the opposite of what I am talking about. It's about letting yourself be interested in, and learn from, other people and not focus so much on feeling like you have to be an entertainer. 

And being an engaged listener is really the opposite of the person who just listens and never wants to talk about themselves. You are putting yourself into the conversation with your interested responses, you are guiding it to places you find interesting. Just suffering through boring conversations is not engaged listening.

",t3_9xbawu,zazzlekdazzle
39,e9r4zo0,9xbawu,"If you admit you're wrong and make changes to whatever it is that you're wrong about, people will respect and appreciate you more.  
  
Unfortunately this requires the swallow_ego.pill patch installed. Without this you will be incapable of being a civil person. ",t3_9xbawu,methedunker
40,e9qw52n,9xbawu,"Just be nice, particularly to people in the service industry. Your job, your personal interactions, even your calls into customer service will go 100% easier if you’re just nice to people and recognize that they’re probably just trying to do their job, not screw you over. ",t3_9xbawu,trillborg
41,e9rg9z5,9xbawu,Act like you belong. In any situation. It will change your life. Also I've found that you become what you pretend to be. So be good.,t3_9xbawu,triple4567
42,e9qxoyf,9xbawu,"Use the word ""soon"" instead of ""later"" with your loved ones or if you are trying to form a new connection with someone. It shows you are interested in talking but currently busy with something.

Eg- Talk to you soon.

Edit-  This doesn't apply to all the scenarios. And it's not creepy or Serial Killery if you follow Rule 1 and 2 (in dating). That's another cheat code in the game of life.

Edit2- [What is Rule 1 and 2](https://www.reddit.com/r/Tinder/comments/4zjmz1/what_is_rule_1_and_2)/",t3_9xbawu,Botatitsbest
43,e9qw2xi,9xbawu,"If you are punctual, smartly dressed, and quite friendly, you can actually get pretty far in most jobs without being that good at anything or trying very hard. ",t3_9xbawu,cold_italian_pizza
44,e9r581z,9xbawu,"If you’re bald and shave your head, you’ll be mistaken for an angry skinhead and panhandlers won’t ask you for money or cigarettes. ",t3_9xbawu,Fromhe
45,e9r6uo5,9xbawu,"""no"" skips the boring side quests.",t3_9xbawu,WhalingBanshee
46,e9r1zeo,9xbawu,"If you work Monday-Friday, spend a small amount of time on Sunday afternoon/evening sorting out your lunch for the week.  I batch cook a pot of something and portion it out into 5 containers.  It saves a ton of money, it's usually healthier and it saves time having to make something quickly each morning because you can just grab a container out of the fridge and go.",t3_9xbawu,DevilRenegade
47,e9qxvrs,9xbawu,"Believe in yourself. I know it sounds cheesy but it’s true: when you believe in yourself anything is possible because you are no longer bound to the expectations of others. Your life truly becomes your own.

Close, close, close runner up would be awareness over your thoughts and emotions. More awareness, more control, less reactions, more happiness.",t3_9xbawu,DepressedBard
48,e9raexl,9xbawu,"Investing money is ridiculously underrated.  There are dividend ETFs that will pay you a monthly dividend.  An easy math gimmick is that $1000 in an ETF that pays 6% is about $5/month.  It doesn't seem like much, but if you work at it you can build your own Basic Income.  Bonus: dividends are taxed way less than regular income.

See /r/personalfinance and /r/financialindependence, or /r/leanfire if you don't make much money.",t3_9xbawu,lf11
49,e9qx5uo,9xbawu,If you're physically attractive you can get away with a lot of shit,t3_9xbawu,clee-saan
50,e9qwjjm,9xbawu,"No matter what your bed time and wake up time is stick with it. After a decade of being that person on Facebook at 3 am and off to work 4 hours later  I started to view sleep as a enjoyable activity not a chore.

Game changer. Mornings are never a drag. If I have trouble sleeping, I can make up for it the next morning with our fucking up my whole day. 


When it’s your bed time, turn off the lights and wait. And don’t touch your ducking phone or your computer. Don’t get out of bed wait. When your alarm goes off, get up. Repeat for two weeks. Enjoy a better life. ",t3_9xbawu,lucy_throwaway
51,e9r6wfv,9xbawu,At a burrito shop get half of one protein and half of another. They usually end up giving you like 20% more (exact science here) plus you get mo’ flavor ,t3_9xbawu,asaking
52,e9r3gij,9xbawu,Mirroring people’s body language and tone of voice will make them comfortable with you quite quickly.,t3_9xbawu,DoveMagnet
53,e9qw20j,9xbawu,"Set the do not disturb feature on your phone to turn on from 10pm-7am. 

You will sleep so much better without constant notifications from emails, games, or your mother in law who wants to send a group message at midnight because she is in a different timezone. 

If you have people you want to be able to reach you (family/girlfriend/boyfriend), you can make a special list that will let only their calls/messages come through. ",t3_9xbawu,
54,e9rdxe0,9xbawu,"Call people by their name, but not annoyingly or too often.  That gets creepy in a hurry.  People love to hear their name and you're a good person for remembering it.",t3_9xbawu,ebjoker4
55,e9reb00,9xbawu,I have a skin colored earpiece Bluetooth that I use it work without anyone knowing so that I can listen to music and podcasts.,t3_9xbawu,jpguitfiddler
56,e9rju78,9xbawu,"Boxes and clothes. You just carry different kinds of boxes and wear different stuff to places. Wanna go to a paid event? Walk around with a large brown box labeled “LIGHTING EQUIPMENT” and a tucked in black polo. Crash a wedding? Walk around with a medium gift-wrapped box and a cheap suit. Get into locked research facilities? Know a name, walk around with a small white box with a lid labeled “Dr. (Name you know)” and a lab coat. Museums? Carry a brown box labeled “restoration equipment” and glasses. Any technology facility? Carry a giant orange box and a hoodie and sweatpants. 

The box is the key. People will open doors. Use their keycards because you can’t reach yours. Allow you into backstage, into storage, into private personnel areas. People will curiously look at you and ask what’s in the box. You will not answer. You only need box. 

The more aggressive security looks, the more you must look like you are struggling with box. Sweat. Huff and puff. A casual box stroll for lazy guards, heavy steps and dragging to aware ones. You do not need charm, or wit, or acting ability, or to be a good liar, or good memory, or even attraciveness. You only need box.

You will gain access to things you never would have dreamed of. Riches normally locked behind security systems and gun-wielding men and digital cameras. But you don’t care about that.

You only care about getting more boxes.",t3_9xbawu,Bigsassyblackwoman
57,e9rdoqf,9xbawu,If you call your boss a cunt you don’t have to go to work any more,t3_9xbawu,pm_ass_pussy_baksack
58,e9r0aub,9xbawu,"Do your best to show your appreciation for the administrative assistants where you work - be friendly, get them Christmas gifts, show your appreciation for the work they do. These people hold an incredible amount of power and can save your ass.",t3_9xbawu,zazzlekdazzle
59,e9ra49v,9xbawu,"If you're at a bar and want a girl's number. Don't ask for her number, instead ask for her snapchat and they will 99% of the time agree regardless if you're ugly, undesirable, etc. Hit them up the next day and see how it goes. I've had good results doing this.

Edit: Not that I'm ugly or undesirable, my mom says I'm handsome :)",t3_9xbawu,Conspicuous1141
60,e9r1htp,9xbawu,Living with in your means makes life pretty easy. ,t3_9xbawu,littleredhoodlum
61,e9r778u,9xbawu,There are no cheat codes in pay2win games.,t3_9xbawu,Caswert
62,e9ra2ib,9xbawu,"just because you don't have the skill they ask for on the job description, doesn't mean you shouldn't apply, You can always get the job first then learn later. Or in most cases, they will almost always train you before you officially start. You're already halfway in the battle when you apply. ",t3_9xbawu,ttran0102
63,e9rdae1,9xbawu,"Introverts think than talk, extroverts think while they talk. 

Took a class that said if you want to run a good meeting, wait 10 seconds before moving on.  Introverts (such as myself) need time to process before they speak.  Started running my meetings this way and I will be damned if the introverts didn't start speaking more and providing really good input.",t3_9xbawu,Shadow082
64,e9r3mfo,9xbawu,"Best one I ever got was a word of advice from my dad: ""Don't go out and try to make friends. Instead, go out and don't make enemies. You'll be amazed at how many friends and acquaintances you have on the other end of this because everyone will see you as friendly and approachable and will even stand up for you as a nice person. If you go out and try to make friends, other people for no real reason, other than you being friends with said person, will dislike you because cliquish foolishness.""

100% true.

Edit: Just to clarify, this was just before I went off to college. I made my closest friends there. Adult life afterwards does require a slightly different strategy, but this does work in very social places like work, church, clubs, etc still in my experience.",t3_9xbawu,HydroSword
65,e9qzj42,9xbawu,Sleep a few hours later so you dont have to pay for lunch ,t3_9xbawu,GlaireWolf
66,e9revd6,9xbawu,Hide ice cream or popsicles inside an empty resealable vegetable bag from Costco or any other store with large resealable bags. Your kids will have no idea they’re there and you can disperse them accordingly or hog them for yourself without them knowing.,t3_9xbawu,mippnles
67,e9re1vp,9xbawu,"Eat fiber at every meal.  Stay away from meals with 0g fiber.  If you are at a loss, eat carrots or celery or an apple with every meal.     

&#x200B;

Avoid colon cancer.

The same amount of calories eaten in a day wherein one has the proper amount (25 - 30g) of fiber will cause more weight loss than one with low to zero fiber.   Easier to lose weight that way.  Easier to maintain healthy weight that way.  

&#x200B;

Fiber is shorthand for ""am I eating healthy?""   If you are getting the right amount, you're almost certainly fine.   And better than 90% of Americans.",t3_9xbawu,0ttr
68,e9qvtsj,9xbawu,Idk still searching for the god mode and all abillity unlock. ,t3_9xbawu,jboer
69,e9r9vac,9xbawu,"If you're ever trying to get somebody to agree with you, nod a lot when you make points and say their first name often. It's used frequently in sales so on the flip side, if you don't want to be sold something and you notice the salesperson doing these things, you can be aware of what they're doing.",t3_9xbawu,ihatefirealarmtests
70,e9rfhcg,9xbawu,"Entering the code ""911"" into your phone lets you spawn copcars.",t3_9xbawu,princessjerome
71,e9qzxva,9xbawu,"If someone is going to complain about you to their boss, or your boss, or call the cops for a noise violation, or something like that, All you have to do is complain about them first and you'll usually come out the victor. In these situations it's way less about who is right and who is wrong, and way more about who lodged the initial complaint against whom.",t3_9xbawu,Outrageous_Claims
72,e9r9vmj,9xbawu,"None of these things are actual ""cheat codes"" though, guys. This is all how to play the game ""correctly"". ",t3_9xbawu,kl0ney
73,e9ra3b6,9xbawu,[deleted],t3_9xbawu,
74,e9r6rcj,9xbawu, Always keep the top half of your gas tank full instead of the bottom half ,t3_9xbawu,ngp888
75,e9r42i7,9xbawu,"Say “Thank you” instead of “I’m sorry” in most situations. 

“Thank you for your patience,” is much better than, “I’m sorry I’m late.”",t3_9xbawu,Ignoble_profession
76,e9r8r34,9xbawu,Messing up my hair and wearing the thousand yard stare makes homeless people ignore you on your walk to work in the morning.,t3_9xbawu,JackPoe
77,e9r5vbz,9xbawu,"Try being, like, crazy good looking.",t3_9xbawu,George_Kostanza
78,e9r3a6u,9xbawu,"Y’all seriously don’t brush ya teeth in the shower? Stay nice and warm and save some time and easy clean up. I hated brushing as a kid but loved showers, wish my parents knew",t3_9xbawu,
79,e9r9vzr,9xbawu,"Build yourself a network of people.  You'd be surprised how valuable contacts are in the professional world.  This can be anything from being asked for help, to getting business from someone, to applying for jobs, to even getting into places you wouldn't otherwise be able to!",t3_9xbawu,punchki
80,e9rb3w5,9xbawu,"I've recently discovered IF: Intermittent Fasting. It's nothing crazy like going weeks without eating but simply keeping my eating window within an 8 hour period. I've lost a LOT of weight, and my doctor has commented on how my BP, HDL/LDL and general well being has improved dramatically. 

Just by skipping breakfast. (Or more technically, eating breakfast around 1 or 2pm instead of 9am)

And yes, both my doctor as well as several others are saying it's perfectly safe and healthy, despite it going against current 'common' knowledge. ",t3_9xbawu,enigmahack
81,e9r037a,9xbawu,Cntrl-alt-delete your ass out of anything that causes you unnecessary stress.,t3_9xbawu,
82,e9rbtcc,9xbawu,"Being able to make a girl orgasm during sex is like a love potion 

Being on time is seen as being a better worker than staying an hour late 

Underpromise and Overdeliver,  show don't tell ",t3_9xbawu,Shenaniganz08
83,e9qvqz8,9xbawu,Be born into a wealthy family.,t3_9xbawu,dottmatrix
84,e9ret30,9xbawu,"Masterbate before any major decisions in life. Women, big purchases anything. Just rub one out then decide. #1 ",t3_9xbawu,JohnStamosEnoughSaid
